{
  "version": 1,
  "sessionId": "550e8400-e29b-41d4-a716-446655440000",
  "profile": "default",
  "project": "/workspace/example-project",
  "startedAt": "2026-03-15T10:00:00Z",
  "endedAt": "2026-03-15T11:30:00Z",
  "branch": "main",
  "lastCommit": "92ee690",
  "durationSec": 5400,
  "tokenUsage": { "input": 50000, "output": 8000 },
  "accomplished": ["Generated example agent configuration"],
  "incomplete": [],
  "events": [
    {
      "t": "2026-03-15T10:05:00Z",
      "event": "delegation",
      "data": { "from": "my-agent", "to": "review-agent" }
    }
  ]
}
